{
  "measurement": "anolis_signal",
  "timestamp_ms": 1711929600060,
  "tags": {
    "runtime_name": "bioreactor-telemetry",
    "provider_id": "bread0",
    "device_id": "rlht0",
    "signal_id": "tc1_temp"
  },
  "fields": {
    "quality": "OK",
    "value_double": 24.1,
    "source_build": "simulated-fixture"
  }
}
